{
  "$schema": "https://json-schema.org/draft/2020-12/schema",
  "$id": "https://github.com/knaoe/blocker-inbox/blob/main/schema/item.schema.json",
  "title": "Blocker item (v1)",
  "description": "One decision, approval or question that an agent needs from a person. Agents write it to items/<id>; people never edit it.",
  "type": "object",
  "required": [
    "v",
    "id",
    "rev",
    "status",
    "title",
    "why",
    "owner",
    "asker",
    "options",
    "asked_at"
  ],
  "additionalProperties": false,
  "properties": {
    "v": {
      "const": 1,
      "description": "Schema version."
    },
    "id": {
      "$ref": "#/$defs/pathSegment",
      "description": "Must equal the document id. Letters, digits and _ . ~ : @ + - only. Suggested form: <asker>-<yyyymmdd>-<slug>. A new question gets a new id."
    },
    "rev": {
      "type": "integer",
      "minimum": 1,
      "description": "Start at 1. Add 1 whenever you change anything a person reads (title, blocked, why, options, recommend, stakes, owner, due, evidence), and remove received in the same write. Taking an answer (received), closing (status, outcome, done_at) and meta do not change rev. An answer only applies to the rev it was given for."
    },
    "status": {
      "enum": [
        "open",
        "done"
      ],
      "description": "open = waiting for an answer, or answered and being worked on. done = the asker has finished; the page shows it under Settled for a few days."
    },
    "title": {
      "type": "string",
      "minLength": 1,
      "maxLength": 120,
      "description": "The decision, phrased as a question a busy person can answer."
    },
    "blocked": {
      "type": "string",
      "maxLength": 80,
      "description": "What is stopped (or waiting) until this is answered, as a short noun phrase."
    },
    "why": {
      "type": "string",
      "minLength": 1,
      "maxLength": 160,
      "description": "Why it matters, in one plain line."
    },
    "owner": {
      "$ref": "#/$defs/ownerKey",
      "description": "Who should decide: a key from config/inbox owners (for example \"lead\", \"ux\", \"repo\"). Set it to your own asker name when you will decide yourself unless someone objects; the card then says that, if nobody answers, you go ahead with the recommended option at `due`."
    },
    "asker": {
      "type": "string",
      "minLength": 1,
      "maxLength": 64,
      "description": "Name of the agent (or person) asking. Shown on the card and used to route the answer back."
    },
    "project": {
      "type": "string",
      "maxLength": 40,
      "description": "Optional short label for the project or team."
    },
    "options": {
      "type": "array",
      "minItems": 2,
      "maxItems": 4,
      "items": {
        "$ref": "#/$defs/option"
      },
      "description": "2 to 4 choices. Each says, in plain words, what happens if it is picked."
    },
    "recommend": {
      "type": "object",
      "required": [
        "key",
        "reason"
      ],
      "additionalProperties": false,
      "properties": {
        "key": {
          "$ref": "#/$defs/optionKey"
        },
        "reason": {
          "type": "string",
          "minLength": 1,
          "maxLength": 160
        }
      },
      "description": "The asker's recommendation and its one-line reason. key must match one of options[].key."
    },
    "stakes": {
      "type": "array",
      "uniqueItems": true,
      "items": {
        "enum": [
          "irreversible",
          "external",
          "money"
        ]
      },
      "description": "Markers shown on the card. irreversible = cannot be undone; external = reaches people outside the team or the public; money = costs or payments. Any marker makes the page ask for a second tap before sending. The page also treats any value it does not know as a marker, so a typo never removes the second tap."
    },
    "blocking": {
      "type": "boolean",
      "default": true,
      "description": "true = the asker's work is stopped until this is answered. false = the asker keeps working, but needs the answer later."
    },
    "evidence": {
      "type": "array",
      "maxItems": 5,
      "items": {
        "$ref": "#/$defs/link"
      },
      "description": "Links that back up the question (pull request, report, draft)."
    },
    "asked_at": {
      "type": "string",
      "format": "date-time",
      "description": "When the question was first asked (ISO 8601 with offset)."
    },
    "due": {
      "type": "string",
      "format": "date-time",
      "description": "When the answer stops being useful. After it passes, the page marks the item overdue and moves it to the top. For an item you own yourself (owner = asker), the time you will go ahead with the recommendation."
    },
    "received": {
      "type": "object",
      "required": [
        "kind",
        "item_rev",
        "answered_at",
        "received_at"
      ],
      "properties": {
        "kind": {
          "enum": [
            "choose",
            "reply",
            "reassign"
          ]
        },
        "item_rev": {
          "type": "integer",
          "minimum": 1
        },
        "key": {
          "type": "string"
        },
        "note": {
          "type": "string"
        },
        "reassign_to": {
          "type": [
            "string",
            "null"
          ]
        },
        "answered_at": {
          "type": "string",
          "format": "date-time"
        },
        "answered_by": {
          "type": [
            "string",
            "null"
          ]
        },
        "received_at": {
          "type": "string",
          "format": "date-time"
        }
      },
      "description": "Before acting on an answer, copy it here and add received_at (an update with if_version). The page then shows the answer as picked up, stops offering to change it, and treats any answer with a different answered_at as a follow-up. Remove it (ArtifactData: \"received\": {\"__delete__\": true}) whenever you add 1 to rev."
    },
    "outcome": {
      "type": "string",
      "maxLength": 200,
      "description": "Set with status done: what you did, in one line (\"Withdrawn: no longer needed\" when you withdraw the question)."
    },
    "done_at": {
      "type": "string",
      "format": "date-time",
      "description": "Set with status done."
    },
    "meta": {
      "type": "object",
      "description": "Free-form data for your own use (thread ids, run ids, reasked_at). The page ignores it."
    }
  },
  "$defs": {
    "pathSegment": {
      "type": "string",
      "pattern": "^(?!\\.{1,2}$)[A-Za-z0-9_.~:@+-]{1,128}$"
    },
    "ownerKey": {
      "type": "string",
      "pattern": "^[A-Za-z0-9_.~:@+-]{1,64}$"
    },
    "optionKey": {
      "type": "string",
      "pattern": "^[A-Za-z0-9_-]{1,12}$",
      "description": "Short key such as A, B, C."
    },
    "option": {
      "type": "object",
      "required": [
        "key",
        "label",
        "consequence"
      ],
      "additionalProperties": false,
      "properties": {
        "key": {
          "$ref": "#/$defs/optionKey"
        },
        "label": {
          "type": "string",
          "minLength": 1,
          "maxLength": 40,
          "description": "What the person picks, short."
        },
        "consequence": {
          "type": "string",
          "minLength": 1,
          "maxLength": 120,
          "description": "What happens if this is picked, in plain words."
        }
      }
    },
    "link": {
      "type": "object",
      "required": [
        "label",
        "url"
      ],
      "additionalProperties": false,
      "properties": {
        "label": {
          "type": "string",
          "minLength": 1,
          "maxLength": 60
        },
        "url": {
          "type": "string",
          "format": "uri",
          "pattern": "^https?://"
        }
      }
    }
  },
  "allOf": [
    {
      "if": {
        "properties": {
          "status": {
            "const": "done"
          }
        },
        "required": [
          "status"
        ]
      },
      "then": {
        "required": [
          "done_at"
        ]
      }
    }
  ]
}
